set testdir [file dirname $argv0]
source $testdir/tester.tcl
set testprefix sync

proc sync_proc {} {
  global syncargs
  lappend syncargs
  expr {[llength $syncargs] <= 2}
}

do_test sync-1.1 {
  execsql {
    CREATE TABLE a(x);
    INSERT INTO a VALUES(1),(2),(3);
  }
  execsql {SELECT count(*) FROM a}
} {3}

ifcapable journalMode {
  catchsql {PRAGMA journal_mode=WAL}
} {0 {}}

do_test sync-1.2 {
  execsql {
    BEGIN;
    UPDATE a SET x=x+1;
    SELECT * FROM a;
  }
} {2 3 4}

do_test sync-1.3 {
  execsql {
    COMMIT;
    SELECT * FROM a;
  }
} {2 3 4}

do_test sync-1.4 {
  execsql {
    BEGIN;
    UPDATE a SET x=x+1;
    SELECT * FROM a;
  }
} {3 4 5}

ifcapable journalMode {
  catchsql {PRAGMA journal_mode=MEMORY}
} {0 {}}

do_test sync-1.5 {
  execsql {
    BEGIN;
    UPDATE a SET x=x+1;
    SELECT * FROM a;
  }
} {4 5 6}

finish_test