set testdir [file dirname $argv0]
source $testdir/tester.tcl
set testprefix sync

do_test sync-1.1 {
  db close
  set DB [sqlite3 db test.db]
  execsql {
    CREATE TABLE t1(a INTEGER PRIMARY KEY);
    CREATE TABLE t2(b INTEGER PRIMARY KEY);
    CREATE INDEX i1 ON t1(a);
    CREATE INDEX i2 ON t2(b);
    INSERT INTO t1 VALUES(1);
    INSERT INTO t2 VALUES(2);
    INSERT INTO t1 VALUES(3);
    INSERT INTO t2 VALUES(4);
  }
  execsql {
    SELECT t1.a, t2.b FROM t1, t2 WHERE t1.a = 1 AND t2.b = 2
  }
} {1 2}

ifcapable journalMode {
  catchsql {PRAGMA journal_mode=WAL}
} {0 {}}

do_test sync-1.2 {
  execsql {
    DELETE FROM t2 WHERE b = 2;
  }
  execsql {
    SELECT t1.a, t2.b FROM t1, t2 WHERE t1.a = 1 AND t2.b = 2
  }
} {1 {}}

do_test sync-1.3 {
  execsql {
    INSERT INTO t2 VALUES(2);
    SELECT t1.a, t2.b FROM t1, t2 WHERE t1.a = 1 AND t2.b = 2
  }
} {1 2}

do_test sync-1.4 {
  execsql {
    SELECT t1.a, t2.b FROM t1, t2 WHERE t1.a = 1 AND t2.b = 2
  }
} {1 2}

do_test sync-1.5 {
  execsql {
    SELECT t1.a, t2.b FROM t1, t2 WHERE t1.a = 1 AND t2.b = 2
  }
} {1 2}

do_test sync-1.6 {
  execsql {
    SELECT t1.a, t2.b FROM t1, t2 WHERE t1.a = 1 AND t2.b = 2
  }
} {1 2}

do_test sync-1.7 {
  execsql {
    SELECT t1.a, t2.b FROM t1, t2 WHERE t1.a = 1 AND t2.b = 2
  }
} {1 2}

do_test sync-1.8 {
  execsql {
    SELECT t1.a, t2.b FROM t1, t2 WHERE t1.a = 1 AND t2.b = 2
  }
} {1 2}

finish_test