set testdir [file dirname $argv0]
source $testdir/tester.tcl
set testprefix sync

proc sync_proc {} {
  global syncargs
  lappend syncargs
  expr {[llength $syncargs] <= 2}
}

set ::sqlite_default_cache_size 100
do_test sync-1.1 {
  execsql {
    CREATE TABLE a(x);
    INSERT INTO a VALUES(1),(2),(3);
  }
  execsql {SELECT count(*) FROM a}
} {3}
do_test sync-1.2 {
  db cache size 200
  execsql {
    CREATE TABLE b(x);
    INSERT INTO b VALUES(4),(5),(6);
  }
  execsql {SELECT count(*) FROM b}
} {3}
do_test sync-1.3 {
  execsql {
    DELETE FROM a WHERE x = 1;
  }
  execsql {SELECT count(*) FROM a}
} {2}
do_test sync-1.4 {
  execsql {
    SELECT x FROM a;
  }
  execsql {SELECT x FROM a}
} {2 3}
ifcapable journalMode {
  catchsql {PRAGMA journal_mode=WAL}
} {0 {}}
ifcapable tempdb {
  do_test sync-1.5 {
    execsql {
      CREATE TABLE t1(x);
      INSERT INTO t1 VALUES(1);
      CREATE TABLE t2 AS SELECT * FROM t1;
    }
  } {}
  do_test sync-1.6 {
    execsql {
      PRAGMA temp_store=memory;
      PRAGMA temp_store_directory;
    }
  } {}
}
finish_test