set testdir [file dirname $argv0]
source $testdir/tester.tcl
set testprefix sync

proc sync_proc {} {
  global syncargs
  lappend syncargs
  expr {[llength $syncargs] <= 2}
}

do_test sync-1.1 {
  execsql {
    CREATE TABLE a(x);
    INSERT INTO a VALUES(1),(2),(3);
  }
  execsql {SELECT count(*) FROM a}
} {3}

ifcapable journalMode {
  catchsql {PRAGMA journal_mode=WAL}
} {0 {}}

do_test sync-1.2 {
  execsql {
    CREATE TABLE b(y);
    INSERT INTO b VALUES(4),(5),(6);
  }
  execsql {SELECT count(*) FROM b}
} {3}

ifcapable journalMode {
  catchsql {PRAGMA journal_mode=MEMORY}
} {0 {}}

do_test sync-1.3 {
  execsql {
    INSERT INTO a VALUES(7);
    INSERT INTO b VALUES(8);
  }
  execsql {SELECT * FROM a}
} {1 2 3 7}
execsql {SELECT * FROM b}
} {4 5 6 8}

do_test sync-1.4 {
  execsql {
    DELETE FROM a WHERE x = 7;
  }
  execsql {SELECT * FROM a}
} {1 2 3}
execsql {SELECT * FROM b}
} {4 5 6 8}

do_test sync-1.5 {
  execsql {
    DROP TABLE a;
    DROP TABLE b;
  }
  catchsql {SELECT * FROM a}
} {1 {no such table: a}}
catchsql {SELECT * FROM b}
} {1 {no such table: b}}

finish_test