set testdir [file dirname $argv0]
source $testdir/tester.tcl
set testprefix sync

do_test sync-1.1 {
  execsql {
    CREATE TABLE a(x);
    INSERT INTO a VALUES(1),(2),(3);
  }
  execsql {SELECT count(*) FROM a}
} {3}

ifcapable journalMode {
  catchsql {PRAGMA journal_mode=WAL}
} {0 {}}

do_test sync-1.2 {
  execsql {
    INSERT INTO a VALUES(4),(5),(6);
  }
  execsql {SELECT count(*) FROM a}
} {6}

do_test sync-1.3 {
  execsql {
    BEGIN;
    UPDATE a SET x=2 WHERE x=1;
    INSERT INTO a VALUES(7),(8),(9);
    COMMIT;
  }
  execsql {SELECT count(*) FROM a}
} {9}

do_test sync-1.4 {
  execsql {
    DELETE FROM a WHERE x=2;
  }
  execsql {SELECT count(*) FROM a}
} {7}

ifcapable journalMode {
  catchsql {PRAGMA journal_mode=MJOURNAL}
} {0 {}}

finish_test