set testdir [file dirname $argv0]
source $testdir/tester.tcl
set testprefix sync
set ::sqlite_options {wal journal_mode memory cache_size 10000}
proc sync_proc {} {
  global syncargs
  lappend syncargs
  expr {[llength $syncargs] <= 2}
}
set syncargs {}
do_test sync-1.1 {
  execsql {
    CREATE TABLE a(x);
    INSERT INTO a VALUES(1),(2),(3);
  }
  execsql {SELECT count(*) FROM a}
} {3}
ifcapable journalMode {
  catchsql {PRAGMA journal_mode=WAL}
} {0 {}}
do_test sync-1.2 {
  execsql {
    BEGIN;
    UPDATE a SET x = x + 1;
    COMMIT;
  }
} {}
do_test sync-1.3 {
  execsql {
    SELECT x FROM a
  }
} {2 3 4}
do_test sync-1.4 {
  execsql {
    DELETE FROM a;
  }
} {}
do_test sync-1.5 {
  execsql {
    SELECT x FROM a
  }
} {}
do_test sync-1.6 {
  execsql {
    INSERT INTO a VALUES(5);
    SELECT x FROM a
  }
} {5}
do_test sync-1.7 {
  execsql {
    SELECT x FROM a
  }
} {5}
do_test sync-1.8 {
  execsql {
    DELETE FROM a;
  }
} {}
do_test sync-1.9 {
  execsql {
    SELECT x FROM a
  }
} {}
do_test sync-1.10 {
  execsql {
    CREATE TABLE b(y);
    INSERT INTO b VALUES(6);
    SELECT y FROM b
  }
} {6}
do_test sync-1.11 {
  execsql {
    SELECT y FROM b
  }
} {6}
do_test sync-1.12 {
  execsql {
    DROP TABLE b;
  }
} {}
do_test sync-1.13 {
  execsql {
    SELECT y FROM b
  }
} {}
do_test sync-1.14 {
  execsql {
    CREATE TABLE b(y);
    INSERT INTO b VALUES(7);
    SELECT y FROM b
  }
} {7}
do_test sync-1.15 {
  execsql {
    SELECT y FROM b
  }
} {7}
do_test sync-1.16 {
  execsql {
    DROP TABLE b;
  }
} {}
do_test sync-1.17 {
  execsql {
    SELECT y FROM b
  }
} {}
do_test sync-1.18 {
  execsql {
    CREATE TABLE b(y);
    INSERT INTO b VALUES(8);
    SELECT y FROM b
  }
} {8}
do_test sync-1.19 {
  execsql {
    SELECT y FROM b
  }
} {8}
do_test sync-1.20 {
  execsql {
    DROP TABLE b;
  }
} {}
do_test sync-1.21 {
  execsql {
    SELECT y FROM b
  }
} {}
do_test sync-1.22 {
  execsql {
    CREATE TABLE b(y);
    INSERT INTO b VALUES(9);
    SELECT y FROM b
  }
} {9}
do_test sync-1.23 {
  execsql {
    SELECT y FROM b
  }
} {9}
do_test sync-1.24 {
  execsql {
    DROP TABLE b;
  }
} {}
do_test sync-1.25 {
  execsql {
    SELECT y FROM b
  }
} {}
do_test sync-1.26 {
  execsql {
    CREATE TABLE b(y);
    INSERT INTO b VALUES(10);
    SELECT y FROM b
  }
} {10}
do_test sync-1.27 {
  execsql {
    SELECT y FROM b
  }
} {10}
do_test sync-1.28 {
  execsql {
    DROP TABLE b;
  }
} {}
do_test sync-1.29 {
  execsql {
    SELECT y FROM b
  }
} {}
do_test sync-1.30 {
  execsql {
    CREATE TABLE b(y);
    INSERT INTO b VALUES(11);
    SELECT y FROM b
  }
} {11}
do_test sync-1.31 {
  execsql {
    SELECT y FROM b
  }
} {11}
do_test sync-1.32 {
  execsql {
    DROP TABLE b;
  }
} {}
do_test sync-1.33 {
  execsql {
    SELECT y FROM b
  }
} {}
do_test sync-1.34 {
  execsql {
    CREATE TABLE b(y);
    INSERT INTO b VALUES(12);
    SELECT y FROM b
  }
} {12}
do_test sync-1.35 {
  execsql {