set testdir [file dirname $argv0]
source $testdir/tester.tcl
set testprefix concurrent

set ::timeout 60000
set conndefault {wal sync off journal_mode wal cache_spill 5000 page_size 8192 default_cache_size 20000}

proc concurrent_function {} {
  global concurrency
  set concurrency 0
}

proc increment_counter {} {
  global concurrency
  incr concurrency
}

do_test concurrent-1.1 {
  db close
  execsql {
    CREATE TABLE b(id, value);
    INSERT INTO b VALUES(1,1);
  }
  execsql {SELECT count(*) FROM b}
} {1}

do_execsql_test concurrent-1.2 {
  BEGIN;
  INSERT INTO b VALUES(2,2);
  COMMIT;
  SELECT count(*) FROM b;
} {2}

do_test concurrent-1.3 {
  set concurrency 5
} {5}

if {$globalrc eq {}} {
  catch {unset using_journal_mode 1}
}

execsql {
  DELETE FROM b
}

catch {close $cdb}
catch {close $dbs}

catch {execsql {
  PRAGMA journal_mode = 'wal';
  }
}
set global_journal_mode wal

do_execsql_test  concurrent-1.4 {
  CREATE TABLE c(x);
  INSERT INTO c VALUES(5);
} {5}

set dbid $GLOBALS_db
set result 0

if {SQLITE_OK}
do_test concurrent-1.5 {
  db eval {CREATE TABLE f(i);}
  foreach x {0 1 2 3 4 6 7 8 9} {
    db eval {INSERT INTO f VALUES(1)}
  }
  db eval {
    BEGIN;
    SELECT * FROM f;
    COMMIT;
    SELECT * FROM f;
  }
} {} else {
  error "INSERT failed $result $?"
}

finish_test