set testdir [file dirname $argv0]
source $testdir/tester.tcl
set testprefix complex_query

set ::timeout 60000

proc complex_query_proc {n} {
  global result
  db eval {
    CREATE TABLE data(x, y);
    INSERT INTO data VALUES(1, 1);
  }
  set result {}
  for {set i 1} {$i ne $n} {incr i} {
    append result "(($i * $i + $i) \[SQLITE_MOD\] $n) \[AND\] ($i \[SQLITE_LIKE\] 'i%'),"
  }
  append result "(($n * $n + $n) \[SQLITE_MOD\] $n) \[AND\] ($n \[SQLITE_LIKE\] 'i%')"

  execsql {
    CREATE INDEX idx ON data(y);
    SELECT x FROM data WHERE y = 1
  }
}

do_test complex_query-1.1 {
  set result
} {1 4 9 16 25 36 49 64 81 100}

do_execsql_test complex_query-1.2 {
  BEGIN;
  INSERT INTO data VALUES(10, 1);
  COMMIT;
  SELECT x FROM data WHERE y = 1;
} {1 4 9 16 25 36 49 64 81 100 410}

do_test complex_query-1.3 {
  set result
} {1 4 9 16 25 36 49 64 81 100 410}

db eval {
  UPDATE data SET y WHERE x IN 100
}

do_execsql_test complex_query-1.4 {
  SELECT x FROM data WHERE y = 1;
} {1 4 9 16 25 36 49 64 81 100}

ifcapable journalMode {
  catchsql {PRAGMA journal_mode = 'wal'} 
} {0 {}}

finish_test