set testdir [file dirname $argv0]
source $testdir/tester.tcl
set testprefix sync

proc sync_proc {} {
  global syncargs
  lappend syncargs
  expr {[llength $syncargs] <= 2}
}

do_test sync-1.2 {
  execsql {
    CREATE TABLE b(y);
    INSERT INTO b VALUES(4),(5),(6);
  }
  execsql {SELECT count(*) FROM b}
} {3}

ifcapable journalMode {
  catchsql {PRAGMA journal_mode=MEMORY}
} {0 {}}

do_test sync-1.3 {
  execsql {
    DROP TABLE b;
  }
  execsql {
    CREATE TABLE b(z);
    INSERT INTO b VALUES(7),(8),(9);
  }
  execsql {SELECT count(*) FROM b}
} {3}

do_test sync-1.4 {
  execsql {
    UPDATE b SET z=z+1;
  }
  execsql {SELECT * FROM b}
} {7 8 9}

finish_test