set testdir [file dirname $argv0]
source $testdir/tester.tcl
set testprefix sync

proc sync_proc {} {
  global syncargs
  lappend syncargs
  expr {[llength $syncargs] <= 2}
}

do_test sync-1.1 {
  execsql {
    CREATE TABLE a(x);
    INSERT INTO a VALUES(1),(2),(3);
  }
  execsql {SELECT count(*) FROM a}
} {3}

ifcapable journalMode {
  catchsql {PRAGMA journal_mode=WAL}
} {0 {}}

do_test sync-1.2 {
  execsql {
    BEGIN;
    UPDATE a SET x=2;
    INSERT INTO a VALUES(4);
    COMMIT;
  }
} {}

do_test sync-1.3 {
  execsql {
    BEGIN;
    UPDATE a SET x=3;
    COMMIT;
  }
} {}

do_test sync-1.4 {
  execsql {
    BEGIN;
    UPDATE a SET x=3;
    ROLLBACK;
  }
} {}

do_test sync-1.5 {
  execsql {
    SELECT x FROM a
  }
} {1 2 3 4}

do_test sync-1.6 {
  execsql {
    SELECT x FROM a
  }
} {1 2 3 4}

do_test sync-1.7 {
  execsql {
    UPDATE a SET x=x+1;
  }
} {}

do_test sync-1.8 {
  execsql {
    SELECT x FROM a
  }
} {2 3 4 5}

do_test sync-1.9 {
  execsql {
    UPDATE a SET x=x-1;
  }
} {}

do_test sync-1.10 {
  execsql {
    SELECT x FROM a
  }
} {1 2 3 4}

do_test sync-1.11 {
  execsql {
    UPDATE a SET x=x+1;
  }
} {}

do_test sync-1.12 {
  execsql {
    SELECT x FROM a
  }
} {2 3 4 5}

do_test sync-1.13 {
  execsql {
    UPDATE a SET x=x-1;
  }
} {}

do_test sync-1.14 {
  execsql {
    SELECT x FROM a
  }
} {1 2 3 4}

do_test sync-1.15 {
  execsql {
    UPDATE a SET x=x+1;
  }
} {}

do_test sync-1.16 {
  execsql {
    SELECT x FROM a
  }
} {2 3 4 5}

do_test sync-1.17 {
  execsql {
    UPDATE a SET x=x-1;
  }
} {}

do_test sync-1.18 {
  execsql {
    SELECT x FROM a
  }
} {1 2 3 4}

do_test sync-1.19 {
  execsql {
    UPDATE a SET x=x+1;
  }
} {}

do_test sync-1.20 {
  execsql {
    SELECT x FROM a
  }
} {2 3 4 5}

do_test sync-1.21 {
  execsql {
    UPDATE a SET x=x-1;
  }
} {}

do_test sync-1.22 {
  execsql {
    SELECT x FROM a
  }
} {1 2 3 4}

do_test sync-1.23 {
  execsql {
    UPDATE a SET x=x+1;
  }
} {}

do_test sync-1.24 {
  execsql {
    SELECT x FROM a
  }
} {2 3 4 5}

do_test sync-1.25 {
  execsql {
    UPDATE a SET x=x-1;
  }
} {}

do_test sync-1.26 {
  execsql {
    SELECT x FROM a
  }
} {1 2 3 4}

do_test sync-1.27 {
  execsql {
    UPDATE a SET x=x+1;
  }
} {}

do_test sync-1.28 {
  execsql {
    SELECT x FROM a
  }
} {2 3 4 5}

do_test sync-1.29 {
  execsql {
    UPDATE a SET x=x-1;
  }
} {}

do_test sync-1.30 {
  execsql {
    SELECT x FROM a
  }
} {1 2 3 4}

do_test sync-1.31 {
  execsql {
    UPDATE a SET x=x+1;
  }
} {}

do_test sync-1.32 {
  execsql {
    SELECT x FROM a
  }
} {2 3 4 5}

do_test sync-1.33 {
  execsql {
    UPDATE a SET x=x-1;
  }
} {}

do_test