set testdir [file dirname $argv0]
source $testdir/tester.tcl
set testprefix sync

proc sync_proc {} {
  global syncargs
  lappend syncargs
  expr {[llength $syncargs] <= 2}
}

do_test sync-1.1 {
  execsql {
    CREATE TABLE a(x);
    INSERT INTO a VALUES(1),(2),(3);
  }
  execsql {SELECT count(*) FROM a}
} {3}

ifcapable journalMode {
  catchsql {PRAGMA journal_mode=WAL}
} {0 {}}

set syncargs {}
do_test sync-1.2 {
  execsql {
    BEGIN;
    UPDATE a SET x=1;
    INSERT INTO a VALUES(4);
    COMMIT;
  }
  execsql {SELECT * FROM a}
} {1 1 1 4}
do_test sync-1.3 {
  execsql {
    UPDATE a SET x=x+1;
    UPDATE a SET x=x+1;
    UPDATE a SET x=x+1;
  }
  execsql {SELECT * FROM a}
} {4 4 4 5}
do_test sync-1.4 {
  execsql {
    UPDATE a SET x=x+1;
    UPDATE a SET x=x+1;
  }
  execsql {SELECT * FROM a}
} {5 5 5 6}
do_test sync-1.5 {
  execsql {
    UPDATE a SET x=x+1;
  }
  execsql {SELECT * FROM a}
} {6 6 6 7}
do_test sync-1.6 {
  execsql {
    UPDATE a SET x=x+1;
  }
  execsql {SELECT * FROM a}
} {7 7 7 8}
do_test sync-1.7 {
  execsql {
    UPDATE a SET x=x+1;
  }
  execsql {SELECT * FROM a}
} {8 8 8 9}
do_test sync-1.8 {
  execsql {
    UPDATE a SET x=x+1;
  }
  execsql {SELECT * FROM a}
} {9 9 9 10}
do_test sync-1.9 {
  execsql {
    UPDATE a SET x=x+1;
  }
  execsql {SELECT * FROM a}
} {10 10 10 11}
do_test sync-1.10 {
  execsql {
    UPDATE a SET x=x+1;
  }
  execsql {SELECT * FROM a}
} {11 11 11 12}
do_test sync-1.11 {
  execsql {
    UPDATE a SET x=x+1;
  }
  execsql {SELECT * FROM a}
} {12 12 12 13}
do_test sync-1.12 {
  execsql {
    UPDATE a SET x=x+1;
  }
  execsql {SELECT * FROM a}
} {13 13 13 14}
do_test sync-1.13 {
  execsql {
    UPDATE a SET x=x+1;
  }
  execsql {SELECT * FROM a}
} {14 14 14 15}
do_test sync-1.14 {
  execsql {
    UPDATE a SET x=x+1;
  }
  execsql {SELECT * FROM a}
} {15 15 15 16}
do_test sync-1.15 {
  execsql {
    UPDATE a SET x=x+1;
  }
  execsql {SELECT * FROM a}
} {16 16 16 17}
do_test sync-1.16 {
  execsql {
    UPDATE a SET x=x+1;
  }
  execsql {SELECT * FROM a}
} {17 17 17 18}
do_test sync-1.17 {
  execsql {
    UPDATE a SET x=x+1;
  }
  execsql {SELECT * FROM a}
} {18 18 18 19}
do_test sync-1.18 {
  execsql {
    UPDATE a SET x=x+1;
  }
  execsql {SELECT * FROM a}
} {19 19 19 20}
do_test sync-1.19 {
  execsql {
    UPDATE a SET x=x+1;
  }
  execsql {SELECT * FROM a}
} {20 20 20 21}
do_test sync-1.20 {
  execsql {
    UPDATE a SET x=x+1;
  }
  execsql {SELECT * FROM a}
} {21 21 21 22}
do_test sync-1.21 {
  execsql {
    UPDATE a SET x=x+1;
  }
  execsql {SELECT * FROM a}
} {22 22 22 23}
do_test sync-1.22 {
  execsql {
    UPDATE a SET x=x