set testdir [file dirname $argv0]
source $testdir/tester.tcl
set testprefix sync

proc sync_proc {} {
  global syncargs
  lappend syncargs
  expr {[llength $syncargs] <= 2}
}

do_test sync-1.1 {
  execsql {
    CREATE TABLE a(x);
    INSERT INTO a VALUES(1),(2),(3);
  }
  execsql {SELECT count(*) FROM a}
} {3}

ifcapable journalMode {
  catchsql {PRAGMA journal_mode=WAL}
} {0 {}}

do_test sync-1.2 {
  execsql {
    BEGIN;
    INSERT INTO a VALUES(4);
    COMMIT;
  }
  execsql {SELECT count(*) FROM a}
} {4}

do_test sync-1.3 {
  execsql {
    UPDATE a SET x = 5 WHERE x = 1;
  }
  execsql {SELECT * FROM a}
} {5 2 3}

do_test sync-1.4 {
  execsql {
    DELETE FROM a WHERE x = 2;
  }
  execsql {SELECT * FROM a}
} {5 3}

ifcapable trigger {
  do_test sync-1.5 {
    execsql {
      CREATE TABLE b(y);
      CREATE TRIGGER b_trig AFTER INSERT ON a FOR EACH ROW
        WHEN NEW.x = 5 BEGIN
          INSERT INTO b VALUES(NEW.x);
        END;
    }
    execsql {INSERT INTO a VALUES(5)}
    execsql {SELECT * FROM b}
  } {5}
}

ifcapable journalMode {
  do_test sync-1.6 {
    execsql {
      PRAGMA journal_mode = DELETE;
      PRAGMA synchronous = OFF;
      PRAGMA wal_checkpoint;
    }
    execsql {INSERT INTO a VALUES(6)}
    execsql {SELECT * FROM a}
  } {5 3 6}
}

finish_test