set testdir [file dirname $argv0]
source $testdir/tester.tcl
set testprefix sync

proc sync_proc {} {
  global syncargs
  lappend syncargs
  expr {[llength $syncargs] <= 2}
}

do_test sync-1.1 {
  execsql {
    CREATE TABLE a(x);
    INSERT INTO a VALUES(1),(2),(3);
  }
  execsql {SELECT count(*) FROM a}
} {3}

ifcapable journalMode {
  catchsql {PRAGMA journal_mode=WAL}
} {0 {}}

do_test sync-1.2 {
  set res [execsql {
    SELECT * FROM a;
  }]
  set res
} {1 2 3}

do_test sync-1.3 {
  execsql {
    UPDATE a SET x = x * 2;
  }
  execsql {SELECT * FROM a}
} {2 4 6}

do_test sync-1.4 {
  execsql {
    DELETE FROM a WHERE x = 4;
  }
  execsql {SELECT * FROM a}
} {2 6}

do_test sync-1.5 {
  execsql {
    SELECT x FROM a ORDER BY x DESC LIMIT 1;
  }
} {6}

ifcapable journalMode {
  do_test sync-1.6 {
    catchsql {
      PRAGMA journal_mode = DELETE
    }
  } {1 {not authorized}}
}

do_test sync-1.7 {
  execsql {
    SELECT * FROM a;
  }
} {2 6}

do_test sync-1.8 {
  execsql {
    SELECT * FROM a ORDER BY x;
  }
} {2 6}

do_test sync-1.9 {
  execsql {
    SELECT x FROM a ORDER BY x LIMIT 1;
  }
} {2}

do_test sync-1.10 {
  execsql {
    SELECT x FROM a ORDER BY x DESC LIMIT 1 OFFSET 1;
  }
} {6}

do_test sync-1.11 {
  execsql {
    SELECT x FROM a ORDER BY x LIMIT 1 OFFSET 1;
  }
} {2}

do_test sync-1.12 {
  execsql {
    SELECT x FROM a ORDER BY x DESC LIMIT 1 OFFSET 1;
  }
} {6}

do_test sync-1.13 {
  execsql {
    SELECT x FROM a ORDER BY x LIMIT 1 OFFSET 2;
  }
} {6}

ifcapable journalMode {
  do_test sync-1.14 {
    catchsql {
      PRAGMA journal_mode = WAL
    }
  } {0 {}}
}

finish_test