set testdir [file dirname $argv0]
source $testdir/tester.tcl
set testprefix sync

proc sync_proc {} {
  global syncargs
  lappend syncargs
  expr {[llength $syncargs] <= 2}
}

ifcapable!shared_cache {
  finish_test
  return
}

do_test sync-1.1 {
  execsql {
    CREATE TABLE a(x);
    INSERT INTO a VALUES(1),(2),(3);
  }
  execsql {SELECT count(*) FROM a}
} {3}

do_test sync-1.2 {
  execsql {
    CREATE TABLE b(y);
    INSERT INTO b VALUES(1),(2),(3);
  }
  execsql {SELECT count(*) FROM b}
} {3}

do_test sync-1.3 {
  execsql {
    BEGIN;
    DELETE FROM b WHERE y=1;
    SELECT count(*) FROM a;
  }
  execsql {SELECT count(*) FROM b}
} {3 2}

do_test sync-1.4 {
  execsql {
    COMMIT;
    SELECT count(*) FROM a;
  }
  execsql {SELECT count(*) FROM b}
} {3 2}

do_test sync-1.5 {
  execsql {
    BEGIN;
    DELETE FROM b WHERE y=2;
    SELECT count(*) FROM a;
  }
  execsql {SELECT count(*) FROM b}
} {3 1}

do_test sync-1.6 {
  execsql {
    ROLLBACK;
    SELECT count(*) FROM a;
  }
  execsql {SELECT count(*) FROM b}
} {3 2}

ifcapable journalMode {
  catchsql {PRAGMA journal_mode=WAL}
} {0 {}}

finish_test