set testdir [file dirname $argv0]
source $testdir/tester.tcl
set testprefix sync

proc sync_proc {} {
  global syncargs
  lappend syncargs
  expr {[llength $syncargs] <= 2}
}

do_test sync-1.1 {
  execsql {
    CREATE TABLE a(x);
    INSERT INTO a VALUES(1),(2),(3);
  }
  execsql {SELECT count(*) FROM a}
} {3}

ifcapable journalMode {
  catchsql {PRAGMA journal_mode=WAL}
} {0 {}}

do_test sync-1.2 {
  execsql {
    BEGIN;
    UPDATE a SET x = x+1;
  }
  execsql {SELECT x FROM a}
} {2 3 4}

do_test sync-1.3 {
  execsql COMMIT
  execsql {SELECT x FROM a}
} {3 4 5}

do_test sync-1.4 {
  execsql {
    CREATE TABLE b(y);
    INSERT INTO b VALUES(6),(7),(8);
  }
  execsql {SELECT count(*) FROM b}
} {3}

do_test sync-1.5 {
  execsql {
    BEGIN;
    UPDATE b SET y = y+1;
  }
  execsql {SELECT y FROM b}
} {7 8 9}

do_test sync-1.6 {
  execsql COMMIT
  execsql {SELECT y FROM b}
} {8 9 10}

do_test sync-1.7 {
  execsql {
    CREATE TABLE c(z);
    INSERT INTO c VALUES(11),(12),(13);
  }
  execsql {SELECT count(*) FROM c}
} {3}

do_test sync-1.8 {
  execsql {
    BEGIN;
    UPDATE c SET z = z+1;
  }
  execsql {SELECT z FROM c}
} {12 13 14}

do_test sync-1.9 {
  execsql COMMIT
  execsql {SELECT z FROM c}
} {13 14 15}

do_test sync-1.10 {
  execsql {
    DROP TABLE a;
    DROP TABLE b;
    DROP TABLE c;
  }
} {}

finish_test