set testdir [file dirname $argv0]
source $testdir/tester.tcl
set testprefix sync

do_test sync-1.1 {
  execsql {
    CREATE TABLE a(x);
    INSERT INTO a VALUES(1),(2),(3);
  }
  execsql {SELECT count(*) FROM a}
} {3}

ifcapable journalMode {
  catchsql {PRAGMA journal_mode=WAL}
} {0 {}}

do_test sync-1.2 {
  execsql {
    BEGIN;
    UPDATE a SET x = x+1;
    COMMIT;
  }
  execsql {SELECT count(*) FROM a}
} {3}

do_test sync-1.3 {
  execsql {
    CREATE TABLE b(x);
    INSERT INTO b VALUES(4),(5),(6);
  }
  execsql {SELECT count(*) FROM b}
} {3}

ifcapable journalMode {
  catchsql {PRAGMA journal_mode=WAL}
} {0 {}}

do_test sync-1.4 {
  execsql {
    BEGIN;
    UPDATE b SET x = x+1;
    COMMIT;
  }
  execsql {SELECT count(*) FROM b}
} {3}

finish_test