set testdir [file dirname $argv0]
source $testdir/tester.tcl
set testprefix sync

proc sync_proc {} {
  global syncargs
  lappend syncargs
  expr {[llength $syncargs] <= 2}
}

set testname sync-1
do_test $testname.1 {
  execsql {
    CREATE TABLE a(x);
    INSERT INTO a VALUES(1),(2),(3);
  }
  execsql {SELECT count(*) FROM a}
} {3}

ifcapable journalMode {
  catchsql {PRAGMA journal_mode=WAL}
} {0 {}}

set testname sync-2
do_test $testname.1 {
  execsql {
    INSERT INTO a VALUES(4),(5),(6);
  }
  execsql {SELECT count(*) FROM a}
} {6}

set testname sync-3
do_test $testname.1 {
  execsql {
    DELETE FROM a WHERE x>3;
  }
  execsql {SELECT count(*) FROM a}
} {3}

set testname sync-4
do_test $testname.1 {
  execsql {
    CREATE TABLE b(x);
    INSERT INTO b VALUES(1),(2),(3);
  }
  execsql {SELECT count(*) FROM b}
} {3}

finish_test