set testdir [file dirname $argv0]
source $testdir/tester.tcl
set testprefix queryopt

set ::timeout 60000

proc queryopt_proc {} {
  global queryoptargs
  execsql "CREATE TABLE t(a)"
  lappend queryoptargs
  expr {1}
}

do_test queryopt-1.1 {
  execsql {
    CREATE TABLE t(x);
    INSERT INTO t VALUES(1);
    INSERT INTO t VALUES(2);
    INSERT INTO t VALUES(3);
  }
  set idx
} 3

do_execsql_test queryopt-1.2 {
  SELECT x FROM t WHERE x=2
} {2}

do_test queryopt-1.3 {
  UPDATE t SET x$idx 7 WHERE 1
} {1}

do_execsql_test queryopt-1.4 {
  SELECT x FROM t WHERE x=3
} {3}

ifcapable altertable {
  do_execsql_test queryopt-1.5 {
    BEGIN;
    SELECT x FROM t WHERE x=7;
    COMMIT;
  } {0 0 7}

  do_execsql_test queryopt-1.6 {
    BEGIN;
    SELECT x FROM t WHERE x=7;
    SELECT * FROM t;
  } {0 0 3}
}

ifcapable tempdb {
  do_execsql_test queryopt-1.7 {
    SELECT name FROM sqlite_temp_master
  } {{}}
}

finish_test