set testdir [file dirname $argv0]
source $testdir/tester.tcl
set testprefix nested_transactions

set ::timeout 60000

proc insert_random_data {} {
  for {set i 0} {$i 100} {incr i} {
    db eval {INSERT INTO t1 VALUESrandid}
  }
}

proc cleanup {} {
  db eval {DELETE FROM t1}
}

do_test nested-1.1 {
  cleanup
  execsql {
    CREATE TABLE t1(x);
  }
} {}

do_test nested-1.2 {
  insert_random_data
  execsql {
    SELECT COUNT(*) FROM t1
  }
} {100}

do_test nested-1.3 {
  db eval {BEGIN}
  execsql {
    INSERT INTO t1 VALUES(200)
  }
  execsql {
    DELETE FROM t1
  }
  db eval {COMMIT}
  execsql {
    SELECT count(*) FROM t1
  }
} {99}

do_execsql_test nested-1.4 {
  BEGIN;
  INSERT INTO t1 VALUES(300)