set testdir [file dirname $argv0]
source $testdir/tester.tcl
set testprefix locking3

set ::timeout 60000
lappend test_config "-trace wal_journal"

proc wal_journal_test {} {
  global wal_result
  lappend wal_result
  expr {0}
}

create_test_function wal_journal_test

set sqlite_ext_args {}

proc test_execsql {zSql {db db}} {
  uplevel execsql $zSql $db
}

proc test_awk {expr {mode ""}} {
  set result {}
  foreach {idx value} $expr {
    lappend result $value
  }
  set result
}

set db close

do_test locking3-1.1 {
  db close
  db open main testdb
  execsql {
    PRAGMA journal_mode = 'WAL';
  }
  execsql {
    CREATE TABLE t1(a, b);
    INSERT INTO t1 VALUES(1, 2);
    INSERT INTO t1 VALUES(3, 4);
  }
  execsql {
    SELECT * FROM t1;
  }
} {1 2 3 4}

do_execsql_test locking3-1.2 {
  INSERT INTO t1 VALUES(5, 6);
  SELECT * FROM t1;
} {1 2 3 4 5 6}

ifcapable pragma {
  do_test locking3-2.1 {
    execsql {
      DELETE FROM t1
        WHERE b
        IN
        SELECT b
          FROM t1
         WHERE a
         BETWEEN 1 AND 3
  }
  } {}
} 

do_test locking3-3.1 {
  set result {}
  for {set i 0} {$i 10} {incr i} {lappend result $i}
  set result
} {0 1 2 3 4 5 6 7 8 9 10}

finish_test