set testdir [file dirname $argv0]
source $testdir/tester.tcl
set testprefix locking

set ::timeout 60000
proc sql_error_handler {} {
  if {$::timeout_running} { timeout_handler }
}

do_test locking-1.1 {
  execsql {
    CREATE TABLE a(x);
    INSERT INTO a VALUES(1);
    CREATE INDEX i ON a(x);
  }
} {}

do_execsql_test locking-1.2 {
  BEGIN;
  INSERT INTO a VALUES(2);
  COMMIT;
  SELECT x FROM a;
} {1 2}

do_test locking-1.3 {
  execsql {
    UPDATE a SET xDating a
  }
} {1 rows changed}

ifcapable pageroptlist {
  set pageroptlist enabled
} else {
  set pageroptlist disabled
}

do_test locking-1.4 {
  catchsql {
    PRAGMA pager_options = "readonly false"
  }
} {1 { pager_options must be a list of options supported by the pager}}
do_test locking-1.5 {
  catchsql {
    PRAGMA pager_options = "option not supported"
  }
} {1 { pager_options must be a list of options supported by the pager}}

db close
ifcapable attached {
  db close
} else {
  db eval {detach a}
}
finish_test